MCQ,Choices,Correct
What is machine learning?,a: A field of study in artificial intelligence concerned with the development and study of statistical algorithms that can learn from data and generalize to unseen data | b: A field of study in computer science concerned with the development and study of algorithms that can learn from data and perform tasks with explicit instructions | c: A field of study in robotics concerned with the development and study of algorithms that can learn from data and perform tasks without explicit instructions | d: A field of study in mathematics concerned with the development and study of algorithms that can learn from data and generalize to unseen data,a
What are some fields where machine learning has been applied?,a: Computer vision and speech recognition | b: Email filtering and agriculture | c: Medicine and large language models | d: All of the above,d
What is the mathematical foundation of machine learning?,a: Data mining | b: Computational statistics | c: Mathematical optimization | d: Unsupervised learning,c
Who coined the term 'machine learning'?,a: Arthur Samuel | b: Donald Hebb | c: Walter Pitts | d: Tom M. Mitchell,a
What is the main objective of modern-day machine learning?,a: To classify data based on models | b: To make predictions for future outcomes based on models | c: To develop algorithms that can learn from data and generalize to unseen data | d: To study human cognitive processes,b
